{
  "$schema": "http://json-schema.org/draft-07/schema#",
  "$id": "CredentialProfile",
  "type": "object",
  "additionalProperties": false,
  "properties": {
    "$schema": {
      "$ref": "defs.json#/definitions/Schema"
    },
    "Name": {
      "type": "string",
      "description": "The name of the credential profile, as it is commonly called.  This is the name that should be used to refer to the credential profile in other documents and discussions"
    },
    "Credential Profile Description": {
      "type": "string",
      "description": "A brief description of the credential profile"
    },
    "Credential Format": {
      "type": "string",
      "description": "The format of the credential."
    },
    "Signing Algorithm": {
      "type": "string",
      "description": "The format of the signing algorithm."
    },
    "Status Algorithm": {
      "type": "string",
      "description": "The format of the status algorithm."
    },
    "Key Management (Issuer)": {
      "type": "string",
      "description": "The format of the key management for the issuer."
    },
    "Key Management (Holder)": {
      "type": "string",
      "description": "The format of the key management for the holder."
    },
    "Issuance Protocol": {
      "type": "string",
      "description": "The format of issuance protocol."
    },
    "Presentation Protocol": {
      "type": "string",
      "description": "The format of the presentation protocol."
    },
    "Trust Management": {
      "type": "string",
      "description": "The format of the trust management."
    },
    "Formal Specification": {
      "type": "string",
      "description": "A link to a formal specification of the credential profile."
    }
  },
  "required": [
    "$schema",
    "Credential Format",
    "Credential Profile Description",
    "Name",
    "Key Management (Holder)",
    "Key Management (Issuer)",
    "Signing Algorithm"
  ],
  "title": "CredentialProfile"
}
