{
  "$schema": "../../schemas/Credential-Profile.json",
  "Name": "Decentralized Identity Interop Profile",
  "Formal Specification": "https://dutchblockchaincoalition.github.io/DIIP/",
  "Credential Profile Description": "Decentralized Identity Interop Profile",
  "Credential Format": "JWT-VC",
  "Signing Algorithm": "ECDSA",
  "Status Algorithm": "Status List 2021",
  "Key Management (Issuer)": "did:web",
  "Key Management (Holder)": "did:jwk",
  "Issuance Protocol": "OpenID4VCI",
  "Presentation Protocol": "OpenID4VP"
}
