{
  "$schema": "../../schemas/Credential-Profile.json",
  "Name": "JSON-LD VCs with BBS (Credential is Secret)",
  "Credential Profile Description": "[Profile description goes here]",
  "Credential Format": "LDP-VC",
  "Signing Algorithm": "BoundBBS+",
  "Status Algorithm": "Status List 2021",
  "Key Management (Issuer)": "did:web",
  "Key Management (Holder)": "credential as secret"
}
