{
  "$schema": "../../schemas/Credential-Profile.json",
  "Name": "JSON-LD VCs with BBS (Holder DID)",
  "Credential Profile Description": "[Profile description goes here]",
  "Credential Format": "LDP-VC",
  "Signing Algorithm": "BBS+ with public key binding",
  "Status Algorithm": "Status List 2021",
  "Key Management (Issuer)": "did:web",
  "Key Management (Holder)": "did:key"
}
